617595 88632.829137000 138.68.14.38 -> 172.89.89.47 SSHv2 102 Encrypted request packet len=36
617596 88632.829320000 172.89.89.47 -> 138.68.14.38 SSHv2 102 Encrypted response packet len=36
617597 88632.901457000 138.68.14.38 -> 172.89.89.47 TCP 66 37026 > ssh [ACK] Seq=2974 Ack=32492 Win=149248 Len=0 TSval=24129864 TSecr=145568538
617598 88633.153143000 138.68.14.38 -> 172.89.89.47 SSHv2 102 Encrypted request packet len=36
617599 88633.153340000 172.89.89.47 -> 138.68.14.38 SSHv2 102 Encrypted response packet len=36
617600 88633.225479000 138.68.14.38 -> 172.89.89.47 TCP 66 37026 > ssh [ACK] Seq=3010 Ack=32528 Win=149248 Len=0 TSval=24129945 TSecr=145568619
617601 88633.625329000 172.89.89.47 -> 58.218.204.66 SSHv2 134 Encrypted response packet len=68
617602 88633.931019000 58.218.204.66 -> 172.89.89.47 TCP 74 36832 > ssh [SYN] Seq=0 Win=29200 Len=0 MSS=1460 SACK_PERM=1 TSval=6951832 TSecr=0 WS=128
617603 88633.931071000 172.89.89.47 -> 58.218.204.66 TCP 74 ssh > 36832 [SYN, ACK] Seq=0 Ack=1 Win=28960 Len=0 MSS=1460 SACK_PERM=1 TSval=145568813 TSecr=6951832 WS=128
617604 88634.042078000 58.218.204.66 -> 172.89.89.47 SSHv2 150 Encrypted request packet len=84
617605 88634.042117000 172.89.89.47 -> 58.218.204.66 TCP 66 ssh > 48133 [ACK] Seq=2796 Ack=1340 Win=31616 Len=0 TSval=145568841 TSecr=6951861
617606 88634.080714000 138.68.14.38 -> 172.89.89.47 SSHv2 110 Encrypted request packet len=44
617607 88634.080963000 172.89.89.47 -> 138.68.14.38 SSHv2 102 Encrypted response packet len=36
617608 88634.153160000 138.68.14.38 -> 172.89.89.47 TCP 66 37026 > ssh [ACK] Seq=3054 Ack=32564 Win=149248 Len=0 TSval=24130177 TSecr=145568850
617609 88634.238371000 138.68.14.38 -> 172.89.89.47 SSHv2 110 Encrypted request packet len=44
617610 88634.238650000 172.89.89.47 -> 138.68.14.38 SSHv2 102 Encrypted response packet len=36
617611 88634.310843000 138.68.14.38 -> 172.89.89.47 TCP 66 37026 > ssh [ACK] Seq=3098 Ack=32600 Win=149248 Len=0 TSval=24130216 TSecr=145568890
617612 88634.375405000 138.68.14.38 -> 172.89.89.47 SSHv2 110 Encrypted request packet len=44
617613 88634.375578000 172.89.89.47 -> 138.68.14.38 SSHv2 102 Encrypted response packet len=36
617614 88634.447747000 138.68.14.38 -> 172.89.89.47 TCP 66 37026 > ssh [ACK] Seq=3142 Ack=32636 Win=149248 Len=0 TSval=24130250 TSecr=145568924
617615 88634.552953000 138.68.14.38 -> 172.89.89.47 SSHv2 110 Encrypted request packet len=44
617616 88634.553149000 172.89.89.47 -> 138.68.14.38 SSHv2 102 Encrypted response packet len=36
617617 88634.625411000 138.68.14.38 -> 172.89.89.47 TCP 66 37026 > ssh [ACK] Seq=3186 Ack=32672 Win=149248 Len=0 TSval=24130295 TSecr=145568969
617618 88634.723666000 138.68.14.38 -> 172.89.89.47 SSHv2 110 Encrypted request packet len=44
617619 88634.723841000 172.89.89.47 -> 138.68.14.38 SSHv2 102 Encrypted response packet len=36
617620 88634.796027000 138.68.14.38 -> 172.89.89.47 TCP 66 37026 > ssh [ACK] Seq=3230 Ack=32708 Win=149248 Len=0 TSval=24130338 TSecr=145569011
617621 88634.830242000 58.218.204.66 -> 172.89.89.47 SSHv2 150 [TCP Retransmission] Encrypted request packet len=84
617622 88634.830266000 172.89.89.47 -> 58.218.204.66 TCP 78 [TCP Dup ACK 617605#1] ssh > 48133 [ACK] Seq=2796 Ack=1340 Win=31616 Len=0 TSval=145569038 TSecr=6952059 SLE=1256 SRE=1340
617623 88634.889197000 138.68.14.38 -> 172.89.89.47 SSHv2 110 Encrypted request packet len=44
617624 88634.889423000 172.89.89.47 -> 138.68.14.38 SSHv2 102 Encrypted response packet len=36
617625 88634.928001000 58.218.204.66 -> 172.89.89.47 TCP 74 [TCP Retransmission] 36832 > ssh [SYN] Seq=0 Win=29200 Len=0 MSS=1460 SACK_PERM=1 TSval=6952082 TSecr=0 WS=128
617626 88634.928031000 172.89.89.47 -> 58.218.204.66 TCP 74 [TCP Retransmission] ssh > 36832 [SYN, ACK] Seq=0 Ack=1 Win=28960 Len=0 MSS=1460 SACK_PERM=1 TSval=145569062 TSecr=6951832 WS=128
617627 88634.961653000 138.68.14.38 -> 172.89.89.47 TCP 66 37026 > ssh [ACK] Seq=3274 Ack=32744 Win=149248 Len=0 TSval=24130379 TSecr=145569053
617628 88635.237032000 138.68.14.38 -> 172.89.89.47 SSHv2 102 Encrypted request packet len=36
617629 88635.237448000 172.89.89.47 -> 138.68.14.38 SSHv2 118 Encrypted response packet len=52
617630 88635.309642000 138.68.14.38 -> 172.89.89.47 TCP 66 37026 > ssh [ACK] Seq=3310 Ack=32796 Win=149248 Len=0 TSval=24130466 TSecr=145569140
617631 88635.568756000 138.68.14.38 -> 172.89.89.47 SSHv2 102 Encrypted request packet len=36
617632 88635.569250000 172.89.89.47 -> 138.68.14.38 SSHv2 118 Encrypted response packet len=52
617633 88635.641467000 138.68.14.38 -> 172.89.89.47 TCP 66 37026 > ssh [ACK] Seq=3346 Ack=32848 Win=149248 Len=0 TSval=24130549 TSecr=145569223
617634 88635.677134000 138.68.14.38 -> 172.89.89.47 SSHv2 102 Encrypted request packet len=36
617635 88635.677501000 172.89.89.47 -> 138.68.14.38 SSHv2 118 Encrypted response packet len=52
617636 88635.787999000 138.68.14.38 -> 172.89.89.47 TCP 66 37026 > ssh [ACK] Seq=3382 Ack=32900 Win=149248 Len=0 TSval=24130586 TSecr=145569250
617637 88635.795820000 138.68.14.38 -> 172.89.89.47 SSHv2 102 Encrypted request packet len=36
617638 88635.796207000 172.89.89.47 -> 138.68.14.38 SSHv2 118 Encrypted response packet len=52
617639 88635.868386000 138.68.14.38 -> 172.89.89.47 TCP 66 37026 > ssh [ACK] Seq=3418 Ack=32952 Win=149248 Len=0 TSval=24130606 TSecr=145569279
617640 88635.929161000 172.89.89.47 -> 58.218.204.66 TCP 74 [TCP Retransmission] ssh > 36832 [SYN, ACK] Seq=0 Ack=1 Win=28960 Len=0 MSS=1460 SACK_PERM=1 TSval=145569313 TSecr=6951832 WS=128
617641 88636.129493000 172.89.89.47 -> 58.218.204.66 SSHv2 134 Encrypted response packet len=68
617642 88636.170624000 138.68.14.38 -> 172.89.89.47 SSHv2 102 Encrypted request packet len=36
617643 88636.171069000 172.89.89.47 -> 138.68.14.38 SSHv2 118 Encrypted response packet len=52
617644 88636.200628000 58.218.204.66 -> 172.89.89.47 TCP 66 36832 > ssh [ACK] Seq=1 Ack=1 Win=29312 Len=0 TSval=6952400 TSecr=145569313
617645 88636.200671000 58.218.204.66 -> 172.89.89.47 SSH 81 Client Protocol: SSH-2.0-PUTTY\r
617646 88636.200680000 172.89.89.47 -> 58.218.204.66 TCP 66 ssh > 36832 [ACK] Seq=1 Ack=16 Win=29056 Len=0 TSval=145569380 TSecr=6952400
617647 88636.214505000 172.89.89.47 -> 58.218.204.66 SSHv2 109 Server Protocol: SSH-2.0-OpenSSH_6.6.1p1 Ubuntu-2ubuntu2.8\r
617648 88636.243205000 138.68.14.38 -> 172.89.89.47 TCP 66 37026 > ssh [ACK] Seq=3454 Ack=33004 Win=149248 Len=0 TSval=24130699 TSecr=145569373
617649 88636.493413000 58.218.204.66 -> 172.89.89.47 SSHv2 118 Encrypted request packet len=52
617650 88636.493460000 172.89.89.47 -> 58.218.204.66 TCP 66 ssh > 48133 [ACK] Seq=2864 Ack=1392 Win=31616 Len=0 TSval=145569454 TSecr=6952474
617651 88636.493477000 58.218.204.66 -> 172.89.89.47 TCP 66 48133 > ssh [FIN, ACK] Seq=1392 Ack=2864 Win=36096 Len=0 TSval=6952474 TSecr=145569363
617652 88636.496261000 172.89.89.47 -> 58.218.204.66 TCP 66 ssh > 48133 [FIN, ACK] Seq=2864 Ack=1393 Win=31616 Len=0 TSval=145569454 TSecr=6952474
617653 88636.813170000 172.89.89.47 -> 58.218.204.66 TCP 1514 [TCP segment of a reassembled PDU]
617654 88636.861107000 58.218.204.66 -> 172.89.89.47 TCP 66 48133 > ssh [ACK] Seq=1393 Ack=2865 Win=36096 Len=0 TSval=6952566 TSecr=145569454
617655 88637.058581000 138.68.14.38 -> 172.89.89.47 SSHv2 102 Encrypted request packet len=36
617656 88637.059465000 172.89.89.47 -> 138.68.14.38 SSHv2 206 Encrypted response packet len=140
617657 88637.085078000 58.218.204.66 -> 172.89.89.47 TCP 78 [TCP Window Update] 36832 > ssh [ACK] Seq=16 Ack=1 Win=32128 Len=0 TSval=6952621 TSecr=145569380 SLE=44 SRE=1492
617658 88637.131662000 138.68.14.38 -> 172.89.89.47 TCP 66 37026 > ssh [ACK] Seq=3490 Ack=33144 Win=149248 Len=0 TSval=24130921 TSecr=145569595
617659 88637.145157000 172.89.89.47 -> 58.218.204.66 TCP 109 [TCP Retransmission] [TCP segment of a reassembled PDU]
617660 88637.415846000 58.218.204.66 -> 172.89.89.47 TCP 66 36832 > ssh [ACK] Seq=16 Ack=1492 Win=32128 Len=0 TSval=6952703 TSecr=145569617
617661 88637.415899000 172.89.89.47 -> 58.218.204.66 SSHv2 266 Server: Key Exchange Init
617662 88637.415923000 58.218.204.66 -> 172.89.89.47 SSHv2 714 Client: Key Exchange Init
617663 88637.453150000 172.89.89.47 -> 58.218.204.66 TCP 66 ssh > 36832 [ACK] Seq=1692 Ack=664 Win=30336 Len=0 TSval=145569694 TSecr=6952703
617664 88638.013159000 172.89.89.47 -> 58.218.204.66 TCP 266 [TCP Retransmission] ssh > 36832 [PSH, ACK] Seq=1492 Ack=664 Win=30336 Len=200 TSval=145569834 TSecr=6952703[Reassembly error, protocol TCP: New fragment overlaps old data (retransmission?)]
617665 88638.285444000 58.218.204.66 -> 172.89.89.47 SSHv2 338 Client: Diffie-Hellman Key Exchange Init
617666 88638.285495000 172.89.89.47 -> 58.218.204.66 TCP 66 ssh > 36832 [ACK] Seq=1692 Ack=936 Win=31616 Len=0 TSval=145569902 TSecr=6952921
617667 88638.290117000 172.89.89.47 -> 58.218.204.66 SSHv2 914 Server: New Keys
617668 88638.418543000 138.68.14.38 -> 172.89.89.47 SSHv2 110 Encrypted request packet len=44
617669 88638.418816000 172.89.89.47 -> 138.68.14.38 SSHv2 118 Encrypted response packet len=52
617670 88638.491113000 138.68.14.38 -> 172.89.89.47 TCP 66 37026 > ssh [ACK] Seq=3534 Ack=33196 Win=149248 Len=0 TSval=24131261 TSecr=145569935
617671 88638.666467000 138.68.14.38 -> 172.89.89.47 SSHv2 102 Encrypted request packet len=36
617672 88638.666753000 172.89.89.47 -> 138.68.14.38 SSHv2 118 Encrypted response packet len=52
617673 88638.738977000 138.68.14.38 -> 172.89.89.47 TCP 66 37026 > ssh [ACK] Seq=3570 Ack=33248 Win=149248 Len=0 TSval=24131323 TSecr=145569997
617674 88639.238341000 138.68.14.38 -> 172.89.89.47 SSHv2 102 Encrypted request packet len=36
617675 88639.238873000 172.89.89.47 -> 138.68.14.38 SSHv2 110 Encrypted response packet len=44
617676 88639.311037000 138.68.14.38 -> 172.89.89.47 TCP 66 37026 > ssh [ACK] Seq=3606 Ack=33292 Win=149248 Len=0 TSval=24131466 TSecr=145570140
617677 88639.325962000 138.68.14.38 -> 172.89.89.47 SSHv2 102 Encrypted request packet len=36
617678 88639.326346000 172.89.89.47 -> 138.68.14.38 SSHv2 110 Encrypted response packet len=44
617679 88639.414914000 138.68.14.38 -> 172.89.89.47 SSHv2 102 Encrypted request packet len=36
617680 88639.415310000 172.89.89.47 -> 138.68.14.38 SSHv2 110 Encrypted response packet len=44
617681 88639.490903000 138.68.14.38 -> 172.89.89.47 SSHv2 102 Encrypted request packet len=36
617682 88639.491345000 172.89.89.47 -> 138.68.14.38 SSHv2 110 Encrypted response packet len=44
617683 88639.563740000 138.68.14.38 -> 172.89.89.47 SSHv2 102 Encrypted request packet len=36
617684 88639.564166000 172.89.89.47 -> 138.68.14.38 SSHv2 110 Encrypted response packet len=44
617685 88639.617149000 172.89.89.47 -> 58.218.204.66 SSHv2 914 [TCP Retransmission] Server: New Keys
617686 88639.634265000 138.68.14.38 -> 172.89.89.47 SSHv2 102 Encrypted request packet len=36
617687 88639.634406000 172.89.89.47 -> 138.68.14.38 SSHv2 102 Encrypted response packet len=36
617688 88639.647999000 172.89.89.47 -> 172.89.89.2  DNS 88 Standard query 0x4f72  A ip-172-89-89-47.ec2.internal
617689 88639.648035000 172.89.89.47 -> 172.89.89.2  DNS 88 Standard query 0xafe8  AAAA ip-172-89-89-47.ec2.internal
617690 88639.649319000  172.89.89.2 -> 172.89.89.47 DNS 104 Standard query response 0x4f72  A 172.89.89.47
617691 88639.652518000  172.89.89.2 -> 172.89.89.47 DNS 149 Standard query response 0xafe8 
617692 88639.671568000 172.89.89.47 -> 138.68.14.38 SSHv2 158 Encrypted response packet len=92
617693 88639.676047000 138.68.14.38 -> 172.89.89.47 TCP 66 37026 > ssh [ACK] Seq=3786 Ack=33468 Win=149248 Len=0 TSval=24131558 TSecr=145570221
617694 88639.706501000 138.68.14.38 -> 172.89.89.47 TCP 66 37026 > ssh [ACK] Seq=3786 Ack=33504 Win=149248 Len=0 TSval=24131565 TSecr=145570239
