  1 0.000000000 172.89.89.47 -> 58.218.204.183 SSH 134 Encrypted response packet len=68
  2 0.255330000 58.218.204.183 -> 172.89.89.47 SSH 150 Encrypted request packet len=84
  3 0.255363000 172.89.89.47 -> 58.218.204.183 TCP 66 ssh > 12233 [ACK] Seq=69 Ack=85 Win=247 Len=0 TSval=123410394 TSecr=8510058
  4 0.293146000 0e:cd:ef:b0:3a:38 -> 0e:f0:a7:23:18:20 ARP 42 Who has 172.89.89.2?  Tell 172.89.89.47
  5 0.293329000 0e:f0:a7:23:18:20 -> 0e:cd:ef:b0:3a:38 ARP 42 172.89.89.2 is at 0e:f0:a7:23:18:20
  6 0.765956000 58.218.204.183 -> 172.89.89.47 SSH 150 [TCP Retransmission] Encrypted request packet len=84
  7 0.765978000 172.89.89.47 -> 58.218.204.183 TCP 78 [TCP Dup ACK 3#1] ssh > 12233 [ACK] Seq=69 Ack=85 Win=247 Len=0 TSval=123410522 TSecr=8510186 SLE=1 SRE=85
  8 2.108055000 172.89.89.47 -> 58.218.204.183 SSH 134 Encrypted response packet len=68
  9 2.621156000 172.89.89.47 -> 58.218.204.183 SSH 134 [TCP Retransmission] Encrypted response packet len=68
 10 2.874776000 58.218.204.183 -> 172.89.89.47 SSH 118 Encrypted request packet len=52
 11 2.874806000 172.89.89.47 -> 58.218.204.183 TCP 66 ssh > 12233 [ACK] Seq=137 Ack=137 Win=247 Len=0 TSval=123411049 TSecr=8510713
 12 2.874819000 58.218.204.183 -> 172.89.89.47 TCP 66 12233 > ssh [FIN, ACK] Seq=137 Ack=137 Win=296 Len=0 TSval=8510713 TSecr=123410986
 13 2.877825000 172.89.89.47 -> 58.218.204.183 TCP 66 ssh > 12233 [FIN, ACK] Seq=137 Ack=138 Win=247 Len=0 TSval=123411050 TSecr=8510713
 14 3.131869000 58.218.204.183 -> 172.89.89.47 TCP 66 12233 > ssh [ACK] Seq=138 Ack=138 Win=296 Len=0 TSval=8510777 TSecr=123411050
 15 3.445061000 58.218.204.183 -> 172.89.89.47 TCP 74 19258 > ssh [SYN] Seq=0 Win=29200 Len=0 MSS=1460 SACK_PERM=1 TSval=8510853 TSecr=0 WS=128
 16 3.445098000 172.89.89.47 -> 58.218.204.183 TCP 74 ssh > 19258 [SYN, ACK] Seq=0 Ack=1 Win=28960 Len=0 MSS=1460 SACK_PERM=1 TSval=123411191 TSecr=8510853 WS=128
 17 3.708137000 58.218.204.183 -> 172.89.89.47 TCP 66 19258 > ssh [ACK] Seq=1 Ack=1 Win=29312 Len=0 TSval=8510919 TSecr=123411191
 18 3.708176000 58.218.204.183 -> 172.89.89.47 SSH 81 Client Protocol: SSH-2.0-PUTTY\r
 19 3.708186000 172.89.89.47 -> 58.218.204.183 TCP 66 ssh > 19258 [ACK] Seq=1 Ack=16 Win=29056 Len=0 TSval=123411257 TSecr=8510919
 20 3.721931000 172.89.89.47 -> 58.218.204.183 SSHv2 109 Server Protocol: SSH-2.0-OpenSSH_6.6.1p1 Ubuntu-2ubuntu2.8\r
 21 3.723778000 172.89.89.47 -> 58.218.204.183 TCP 1514 [TCP segment of a reassembled PDU]
 22 3.979525000 58.218.204.183 -> 172.89.89.47 TCP 66 19258 > ssh [ACK] Seq=16 Ack=44 Win=29312 Len=0 TSval=8510986 TSecr=123411261
 23 3.979552000 172.89.89.47 -> 58.218.204.183 SSHv2 266 Server: Key Exchange Init
 24 3.979690000 58.218.204.183 -> 172.89.89.47 SSHv2 714 Client: Key Exchange Init
 25 4.017145000 172.89.89.47 -> 58.218.204.183 TCP 66 ssh > 19258 [ACK] Seq=1692 Ack=664 Win=30336 Len=0 TSval=123411335 TSecr=8510987
 26 4.019595000 58.218.204.183 -> 172.89.89.47 TCP 66 19258 > ssh [ACK] Seq=664 Ack=1492 Win=32128 Len=0 TSval=8510997 TSecr=123411261
 27 4.236987000 58.218.204.183 -> 172.89.89.47 TCP 66 19258 > ssh [ACK] Seq=664 Ack=1692 Win=35072 Len=0 TSval=8511051 TSecr=123411325
 28 4.274836000 58.218.204.183 -> 172.89.89.47 SSHv2 338 Client: Diffie-Hellman Key Exchange Init
 29 4.274859000 172.89.89.47 -> 58.218.204.183 TCP 66 ssh > 19258 [ACK] Seq=1692 Ack=936 Win=31616 Len=0 TSval=123411399 TSecr=8511060
 30 4.279406000 172.89.89.47 -> 58.218.204.183 SSHv2 914 Server: New Keys
 31 4.538650000 58.218.204.183 -> 172.89.89.47 SSHv2 82 Client: New Keys
 32 4.577166000 172.89.89.47 -> 58.218.204.183 TCP 66 ssh > 19258 [ACK] Seq=2540 Ack=952 Win=31616 Len=0 TSval=123411475 TSecr=8511126
 33 4.834740000 58.218.204.183 -> 172.89.89.47 SSHv2 118 Encrypted request packet len=52
 34 4.834778000 172.89.89.47 -> 58.218.204.183 TCP 66 ssh > 19258 [ACK] Seq=2540 Ack=1004 Win=31616 Len=0 TSval=123411539 TSecr=8511200
 35 4.834917000 172.89.89.47 -> 58.218.204.183 SSHv2 118 Encrypted response packet len=52
 36 5.092589000 58.218.204.183 -> 172.89.89.47 SSHv2 134 Encrypted request packet len=68
 37 5.093791000 172.89.89.47 -> 172.89.89.2  DNS 87 Standard query 0x0c72  PTR 183.204.218.58.in-addr.arpa
 38 5.094176000  172.89.89.2 -> 172.89.89.47 DNS 143 Standard query response 0x0c72 No such name
 39 5.094787000 172.89.89.47 -> 58.218.204.183 SSHv2 134 Encrypted response packet len=68
 40 5.352283000 58.218.204.183 -> 172.89.89.47 SSHv2 150 Encrypted request packet len=84
 41 5.389147000 172.89.89.47 -> 58.218.204.183 TCP 66 ssh > 19258 [ACK] Seq=2660 Ack=1156 Win=31616 Len=0 TSval=123411678 TSecr=8511330
 42 6.889685000 172.89.89.47 -> 58.218.204.183 SSHv2 134 Encrypted response packet len=68
 43 7.147695000 58.218.204.183 -> 172.89.89.47 SSHv2 150 Encrypted request packet len=84
 44 7.147729000 172.89.89.47 -> 58.218.204.183 TCP 66 ssh > 19258 [ACK] Seq=2728 Ack=1240 Win=31616 Len=0 TSval=123412117 TSecr=8511778
 45 7.374963000 116.31.116.17 -> 172.89.89.47 TCP 74 39125 > ssh [SYN] Seq=0 Win=29200 Len=0 MSS=1460 SACK_PERM=1 TSval=16668669 TSecr=0 WS=128
 46 7.375004000 172.89.89.47 -> 116.31.116.17 TCP 74 ssh > 39125 [SYN, ACK] Seq=0 Ack=1 Win=28960 Len=0 MSS=1460 SACK_PERM=1 TSval=123412174 TSecr=16668669 WS=128
 47 7.611731000 116.31.116.17 -> 172.89.89.47 TCP 66 39125 > ssh [ACK] Seq=1 Ack=1 Win=29312 Len=0 TSval=16668728 TSecr=123412174
 48 7.612732000 116.31.116.17 -> 172.89.89.47 SSH 81 Client Protocol: SSH-2.0-PUTTY\r
 49 7.612751000 172.89.89.47 -> 116.31.116.17 TCP 66 ssh > 39125 [ACK] Seq=1 Ack=16 Win=29056 Len=0 TSval=123412233 TSecr=16668728
 50 7.625603000 172.89.89.47 -> 116.31.116.17 SSHv2 109 Server Protocol: SSH-2.0-OpenSSH_6.6.1p1 Ubuntu-2ubuntu2.8\r
